{
  "contract_version": "1.0",
  "id_operacion": "123e4567-e89b-42d3-a456-426614174100",
  "tipo": "PERSONA_CREAR",
  "persona_uuid": null,
  "expected_persona_version": 0,
  "persona": {
    "tipo_documento": "CC",
    "numero_documento": "100200300",
    "nombres": "ANA",
    "apellidos": "PEREZ",
    "celular": "3001234567",
    "rh": "O+",
    "correo": "ana@example.edu.co"
  },
  "ocurrido_en": "2026-08-30 16:00:00",
  "usuario": { "id": "42", "nombre": "AUXILIAR TIC", "rol": "CARNETIZACION" }
}
